File Name,Extracted Text
brain_buffering.jpeg,"When you meditate, journal, cut off toxic people, drink water, sleep early...\n...and still feel like your brain is buffering."
for_money.webp,"Going off to work each morning like:\nFor Money"
github_actions.webp,"GitHub Actions"
linkedin.webp,"LinkedIn\nYou appeared in 367 searches this week\nWoah.\nSo where's my job?"
stranger_things.webp,"If Stranger Things was British.\nBIT ODD INNIT?"
brand_nutella.jpg,"When someone buys off-brand Nutella\nYou must be a Weasley!"